V1,V2,V3,V4,V5,V6,V7,V8,V9,V10,Intro,Intro2,HighCurl,HighCurl_RT_1,HighCurl_RT_2,HighCurl_RT_3,HighCurl_RT_4,LowCurl,LowCurl_RT_1,LowCurl_RT_2,LowCurl_RT_3,LowCurl_RT_4,ShapeFirstShape,ShapeFirstHeight,ShapeFirst_RT_1,ShapeFirst_RT_2,ShapeFirst_RT_3,ShapeFirst_RT_4,ShapeSecondHeight,ShapeSecondShape,ShapeSecond_RT_1,ShapeSecond_RT_2,ShapeSecond_RT_3,ShapeSecond_RT_4,OpenQuestion,ComprehensionQuestio,Age,Gender,Handedness,NativeLanguage,TurkGate,DO-BR-FL_5,DO-BR-FL_31,DO-Q-ShapeFirstShape,LocationLatitude,LocationLongitude,LocationAccuracy,
R_23gBaETvcPIOrs5,Default Response Set,Anonymous,,,73.4.115.32,0,2017-04-02 17:03:20,2017-04-02 17:05:26,0,1,1,1,0,0,8.486,0,,,,,,C-shaped,small,3.739,17.663,23.593,4,,,,,,,I wasn't sure if the size referred to the space between the fingers or the circle shape formed by the fingers,9,48,2,1,English,,HighCurl,ShapeFirst,,,,-1,
R_1nV1pdNk7nfDboT,Default Response Set,Anonymous,,,72.83.12.78,0,2017-04-02 17:02:26,2017-04-02 17:02:46,0,1,1,,,,,,1,0,0,9.111,0,,,,,,,,,,,,,,,,,,,,LowCurl,ShapeFirst,,,,-1,
R_3nlpYB00p13T6LA,Default Response Set,Anonymous,,,142.105.221.216,0,2017-04-03 03:46:15,2017-04-03 03:47:46,0,1,1,1,0,0,8.508,0,,,,,,A round object,Small,1.874,1.874,34.909,1,,,,,,,"This is a sign that something is small, only an inch or two across. ",9,31,1,1,English,,HighCurl,ShapeFirst,,,,-1,
R_1M4nMTOTxGYahnT,Default Response Set,Anonymous,,,99.45.168.143,0,2017-04-03 03:15:17,2017-04-03 03:16:50,0,1,1,1,1.467,1.714,7.881,2,,,,,,,,,,,,"unsure, but not a very tiny thing (smaller than hands/fingers) since it doesn't look like the person made an effort to indicate that it was small",round or circle shape,5.757,5.757,51.938,1,none,9,30,1,1,english,,HighCurl,ShapeSecond,,,,-1,
R_1nVJ012enakgaAU,Default Response Set,Anonymous,,,173.171.28.151,0,2017-04-03 02:03:19,2017-04-03 02:05:28,0,1,1,,,,,,1,4.443,4.443,8.924,1,A dog.  Thumb and index finger show the snout and the other fingers show the ears.,Large.  The hands seem to show an exaggeration to indicate large size.,2.533,18.875,101.461,3,,,,,,,,,,,,,,LowCurl,ShapeFirst,,,,-1,
R_DPtEZbP8L0UUvuh,Default Response Set,Anonymous,,,97.87.102.203,0,2017-04-02 17:47:26,2017-04-02 17:49:53,0,1,1,1,0,0,8.435,0,,,,,,,,,,,,The object was about two inches across. It would be the size of the thumb and finger of a hand.,The object looked like an open ended wrench.,2.873,81.176,82.912,8,NA,9,67,2,1,English,,HighCurl,ShapeSecond,,,,-1,
R_21igZ7xiiOaKHtt,Default Response Set,Anonymous,,,96.42.3.129,0,2017-04-02 17:44:52,2017-04-02 17:48:49,0,1,1,,,,,,1,0,0,7.611,0,"Mostly circular, but a little oblong too.","Probably no more than three inches in diameter, since it looked like a pretty small hand.",5.791,5.791,69.115,1,,,,,,,"Pretty straightforward, that's about it.",9,39,2,1,English,,LowCurl,ShapeFirst,,,,-1,
R_1eRxeeEl9rrbYfu,Default Response Set,Anonymous,,,24.198.188.151,0,2017-04-03 03:36:18,2017-04-03 03:38:42,0,1,1,1,0,0,7.544,0,,,,,,a circle,a half dollar,3.814,11.461,21.241,2,,,,,,,none,9,51,1,1,english,,HighCurl,ShapeFirst,,,,-1,
R_2P4OJqmtDm3DTgY,Default Response Set,Anonymous,,,75.139.172.59,0,2017-04-03 03:17:54,2017-04-03 03:18:55,0,1,1,,,,,,1,0,0,10.163,0,,,,,,,The size of a hand,A gang sign,2.523,2.523,13.118,1,"Looked like the ""crip killer"" hand sign",9,27,1,3,English,,LowCurl,ShapeSecond,,,,-1,
R_3nMjaHHYZiZhZhD,Default Response Set,Anonymous,,,72.199.66.86,0,2017-04-03 01:26:18,2017-04-03 01:27:25,0,1,1,,,,,,1,0,0,10.182,0,,,,,,,,,,,,,,,,,,,,LowCurl,ShapeFirst,,,,-1,
R_1BVslKRSEwDONrG,Default Response Set,Anonymous,,,24.120.53.22,0,2017-04-03 01:23:06,2017-04-03 01:24:14,0,1,1,,,,,,1,0,0,10.065,0,,,,,,,The size of a large orb,Circular ,2.138,2.138,21.054,1,I saw fingers,9,31,2,3,english,,LowCurl,ShapeSecond,,,,-1,
R_CmHTzJOPFFaTWk9,Default Response Set,Anonymous,,,104.207.136.68,0,2017-04-02 17:47:31,2017-04-02 17:52:19,0,1,1,1,0,0,7.435,0,,,,,,,,,,,,,,,,,,,,,,,,,HighCurl,ShapeSecond,,,,-1,
R_1dEtXhgWXglvMt6,Default Response Set,Anonymous,,,24.29.74.151,0,2017-04-03 03:38:24,2017-04-03 03:39:26,0,1,1,,,,,,1,5.238,6.503,7.489,2,,,,,,,Big.,Round and wide.,1.415,13.46,18.651,4,N/A,9,49,2,1,English,,LowCurl,ShapeSecond,,,,-1,
R_231lKTHxYfVAXCx,Default Response Set,Anonymous,,,174.204.1.109,0,2017-04-03 03:17:35,2017-04-03 03:18:17,0,1,1,1,1.561,4.313,7.402,2,,,,,,C,Medium sized,1.917,4.66,10.687,4,,,,,,,None,9,36,1,1,English,,HighCurl,ShapeFirst,,,,-1,
R_ylGyFNfhMqJsMdX,Default Response Set,Anonymous,,,172.250.198.208,0,2017-04-03 03:10:03,2017-04-03 03:11:55,0,1,1,,,,,,1,0,0,9.194,0,,,,,,,The object was the side of a tennis ball it was about as large as a cupped hand,The object was round like an orange the whole hand curved around it,7.055,7.055,49.925,1,It might have had a ring or holder that the two first index fingers grasped,9,28,1,1,English,,LowCurl,ShapeSecond,,,,-1,
R_1P7rppeu1xLr2Sk,Default Response Set,Anonymous,,,73.199.11.6,0,2017-04-03 01:50:34,2017-04-03 01:52:34,0,1,1,1,5.726,8.135,8.351,5,,,,,,,,,,,,About the size of an apple.,Circle.,2.395,14.877,15.434,2,NA,9,22,2,1,English,,HighCurl,ShapeSecond,,,,-1,
R_2CCz4ESAcP4vBoR,Default Response Set,Anonymous,,,72.234.73.228,0,2017-04-03 01:38:04,2017-04-03 01:40:00,0,1,1,,,,,,1,6.547,7.258,8.2,2,Round with a bump on the top,Large,4.222,29.684,31.921,9,,,,,,,None,9,40,2,1,English,,LowCurl,ShapeFirst,,,,-1,
R_21FzzQd4H4Fie8O,Default Response Set,Anonymous,,,76.89.152.238,0,2017-04-03 01:24:54,2017-04-03 01:25:17,0,1,1,,,,,,1,0,0,7.652,0,,,,,,,,,,,,,,,,,,,,LowCurl,ShapeSecond,,,,-1,
R_3iP7wM4ZI6WlHFD,Default Response Set,Anonymous,,,24.177.0.173,0,2017-04-02 17:44:33,2017-04-02 17:46:25,0,1,1,,,,,,1,0,0,7.185,0,,,,,,,2- 3 inches in diameter,round,2.308,2.308,32.037,1,Seems like a common gesture for smaller round items,9,58,2,2,English,,LowCurl,ShapeSecond,,,,-1,
R_2wLJ0SnUv8U8erX,Default Response Set,Anonymous,,,24.180.179.213,0,2017-04-02 17:42:49,2017-04-02 17:43:09,0,1,1,1,0,0,7.241,0,,,,,,,,,,,,,,,,,,,,,,,,,HighCurl,ShapeFirst,,,,-1,
R_24epV0qdlxoANwK,Default Response Set,Anonymous,,,76.116.164.213,0,2017-04-02 17:43:31,2017-04-02 17:45:45,0,1,1,,,,,,1,0,0,7.382,0,"It is rounded, like a backwards letter C.  There is a square sticking out of the top.",Not very big.,2.446,2.446,49.274,1,,,,,,,"It's difficult to know the size that it is supposed to represent because it is being made with a hand, which is relatively small.",9,36,2,1,English,,LowCurl,ShapeFirst,,,,-1,
R_2P6d2YoZNJg9Uoq,Default Response Set,Anonymous,,,66.75.36.159,0,2017-04-02 17:38:07,2017-04-02 17:40:00,0,1,1,,,,,,1,0,0,8.078,0,,,,,,,"In my mind, the object was the size of an orange.","In my mind, it was the shape of a circle.",6.606,47.71,65.215,3,N/A,9,44,2,1,English,,LowCurl,ShapeSecond,,,,-1,
R_1eL9akUNWADWXFQ,Default Response Set,Anonymous,,,98.242.184.133,0,2017-04-02 17:44:08,2017-04-02 17:46:09,0,1,1,,,,,,1,0,0,8.732,0,,,,,,,It was around the size of a small hand ball (around 1/3 a cubic foot in diameter).,Circular/circle/round.,1.382,67.564,68.029,7,"Thanks. I didn't quite get what kind of detailed answers are expected, but I gave it a shot.",9,25,1,1,English,,LowCurl,ShapeSecond,,,,-1,
R_Oqwcg5YXdUwrepz,Default Response Set,Anonymous,,,71.224.180.126,0,2017-04-02 17:43:52,2017-04-02 17:45:25,0,1,1,1,0,0,7.045,0,,,,,,,,,,,,The size was about the size of a clementine orange.,The letter C,7.912,26.783,30.821,4,None,9,37,2,2,English,,HighCurl,ShapeSecond,,,,-1,
R_3KpxUUMcvDR4RHi,Default Response Set,Anonymous,,,72.174.173.118,0,2017-04-02 17:43:28,2017-04-02 17:45:19,0,1,1,,,,,,1,0,0,7.575,0,A Letter C as in Crip,"Medium size, a small hand with a medium size picture",1.655,43.061,44.533,8,,,,,,,"Growing up in the hood, I would be shot throwing that sign up.",9,36,1,1,English,,LowCurl,ShapeFirst,,,,-1,
R_2bOBgLmhpYuOCRf,Default Response Set,Anonymous,,,24.38.193.69,0,2017-04-02 17:25:31,2017-04-02 17:29:07,0,1,1,,,,,,1,2.071,2.071,7.372,1,,,,,,,,,,,,,,,,,,,,LowCurl,ShapeFirst,,,,-1,
R_3ivQXgtpVBBAhMb,Default Response Set,Anonymous,,,71.176.109.214,0,2017-04-02 17:24:56,2017-04-02 17:26:28,0,1,1,1,5.295,5.295,7.55,1,,,,,,,,,,,,Little.  Maybe two or three inches ,It was a square,4.124,27.422,38.367,6,None,9,37,1,1,English ,,HighCurl,ShapeSecond,,,,-1,
R_2tbu9GOinvIab9W,Default Response Set,Anonymous,,,74.71.163.62,0,2017-04-02 17:10:08,2017-04-02 17:11:45,0,1,1,1,0,0,8.606,0,,,,,,i was a semi circle. shaped like a backwards C.,not to big. maybe a few inches.,4.524,36.332,57.898,4,,,,,,,thanks,9,37,1,1,english,,HighCurl,ShapeFirst,,,,-1,
R_3dKT9ruH6Xc9oBb,Default Response Set,Anonymous,,,24.40.80.160,0,2017-04-02 17:04:02,2017-04-02 17:44:33,0,1,1,1,0,0,8.02,0,,,,,,,,,,,,,,,,,,,,,,,,,HighCurl,ShapeSecond,,,,-1,
R_2ypZXi0DTXJGcbu,Default Response Set,Anonymous,,,98.242.255.44,0,2017-04-03 05:58:42,2017-04-03 05:59:52,1,1,1,1,0,0,9.98,0,,,,,,It was a circle.,It was the size of a golf ball.,0.931,2.72,15.778,2,,,,,,,None,9,29,1,1,English,1,HighCurl,ShapeFirst,,25.982498168945,-80.343399047852,-1,
R_1kUGe4YrZuCUWKD,Default Response Set,Anonymous,,,73.233.150.132,0,2017-04-03 05:58:43,2017-04-03 06:01:34,1,1,1,,,,,,1,0,0,7.591,0,a backwards C,medium,2.464,2.464,8.963,1,,,,,,,most people cannot make the gesture that was shown; our muscles and tendons do not allow it such a type of stretch.,9,35,1,1,english,1,LowCurl,ShapeFirst,,40.102996826172,-74.941497802734,-1,
R_2BlFRp5sb7PHJcs,Default Response Set,Anonymous,,,68.250.117.122,0,2017-04-03 06:01:47,2017-04-03 06:02:57,1,1,1,1,3.625,4.55,7.912,2,,,,,,,,,,,,Small,Circular,1.199,1.204,11.187,2,n/a,9,31,2,1,English,1,HighCurl,ShapeSecond,,41.626998901367,-88.204002380371,-1,
R_10VELfZt8NEU6S3,Default Response Set,Anonymous,,,71.77.226.116,0,2017-04-03 06:04:00,2017-04-03 06:05:16,1,1,1,,,,,,1,0,0,7.528,0,,,,,,,Large.,OK symbol.,1.779,1.779,13.86,1,Took me a little by surprise.,9,28,1,1,English,1,LowCurl,ShapeSecond,,34.292602539062,-78.675903320312,-1,
R_3HM2wbMFnmY0IDv,Default Response Set,Anonymous,,,12.204.222.254,0,2017-04-03 05:58:39,2017-04-03 06:08:05,1,1,1,,,,,,1,0,0,7.521,0,A circle,"Relatively large, based on how big the person was making it",40.667,58.002,58.286,2,,,,,,,Nothing else so far,9,37,1,1,English,1,LowCurl,ShapeFirst,,35.108001708984,-85.152603149414,-1,
R_2B3Zq95C37xaOdc,Default Response Set,Anonymous,,,71.190.250.26,0,2017-04-03 06:08:12,2017-04-03 06:12:43,1,1,1,,,,,,1,0,0,8.768,0,,,,,,,A child's right hand with a gesture.,It looks like an opposite side of C shape.,7.853,59.665,123.886,2,None.,9,40,2,1,English,1,LowCurl,ShapeSecond,,40.859405517578,-73.212097167969,-1,
R_25zp585JntaaeFN,Default Response Set,Anonymous,,,216.57.222.134,0,2017-04-03 06:47:03,2017-04-03 06:48:51,1,1,1,1,0,0,7.982,0,,,,,,a cube or box shaped item.,small,3.745,36.513,44.458,2,,,,,,,None,9,42,1,1,English,1,HighCurl,ShapeFirst,,48.798202514648,-122.40980529785,-1,
R_1jZK0Uj2CizmbPq,Default Response Set,Anonymous,,,74.98.211.120,0,2017-04-03 06:58:05,2017-04-03 06:59:28,1,1,1,1,0,0,7.855,0,,,,,,,,,,,,small,round,5.832,5.832,9.87,1,none,9,38,2,1,English,1,HighCurl,ShapeSecond,,40.434494018555,-79.866096496582,-1,
R_3qCMM3XJlsvyvgl,Default Response Set,Anonymous,,,73.42.60.41,0,2017-04-03 06:58:43,2017-04-03 06:59:49,1,1,1,,,,,,1,0,0,7.989,0,ball,small,1.446,1.446,6.934,1,,,,,,,none,9,27,2,2,English only,1,LowCurl,ShapeFirst,,30.231597900391,-85.501998901367,-1,
R_ZgUUxEIBfav2Ojf,Default Response Set,Anonymous,,,68.118.139.157,0,2017-04-03 06:57:21,2017-04-03 07:01:07,1,1,1,1,0,0,8.008,0,,,,,,,,,,,,the object size was very small and able to hold between 2 fingers,the object was the shape of the letter c,2.109,90.194,101.387,5,no comments,9,34,1,1,english,1,HighCurl,ShapeSecond,,33.998901367188,-117.44079589844,-1,
R_81Eq7QsuUPbvVFD,Default Response Set,Anonymous,,,50.83.75.194,0,2017-04-03 07:07:33,2017-04-03 07:08:51,1,1,1,,,,,,1,0,0,51.111,0,It was round,It was small,1.89,1.89,7.12,1,,,,,,,na,9,33,1,1,english,1,LowCurl,ShapeFirst,,30.479797363281,-87.865798950195,-1,
R_3jfk5AdWcsaaSgG,Default Response Set,Anonymous,,,67.212.209.118,0,2017-04-03 07:31:54,2017-04-03 07:32:38,1,1,1,1,2.71,2.71,8.172,1,,,,,,,,,,,,2 inches,a sphere,2.833,2.833,7.51,1,none,9,22,1,3,english,1,HighCurl,ShapeSecond,,46.628799438477,-87.479598999023,-1,
R_2S3orKSjrn2L5tt,Default Response Set,Anonymous,,,107.12.163.74,0,2017-04-03 07:32:20,2017-04-03 07:34:14,1,1,1,1,0,0,8.939,0,,,,,,I viewed it as being round.,I viewed it as being something small.,1.723,25.889,36.015,4,,,,,,,n/a,9,40,2,1,English,1,HighCurl,ShapeFirst,,34.900802612305,-76.826202392578,-1,
R_cCmzlR8kNttEICZ,Default Response Set,Anonymous,,,98.214.215.40,0,2017-04-03 07:32:04,2017-04-03 07:34:34,1,1,1,,,,,,1,0,0,42.17,0,,,,,,,The object was the size of a hand,It was in the shape of a backwards letter C,1.697,1.697,41.034,1,I hope I did what you wanted,9,42,1,1,English,1,LowCurl,ShapeSecond,,39.915496826172,-88.891799926758,-1,
R_1qZYXVRnFtvb1Gl,Default Response Set,Anonymous,,,72.80.33.72,0,2017-04-03 07:34:27,2017-04-03 07:36:06,1,1,1,,,,,,1,0,0,9.459,0,,,,,,,two inches,the shape was a letter c,11.243,11.243,39.291,1,no comments ,9,33,2,1,English,1,LowCurl,ShapeSecond,,40.735397338867,-73.878303527832,-1,
R_2QSY8DD3aG74ss7,Default Response Set,Anonymous,,,8.20.70.240,0,2017-04-03 07:39:47,2017-04-03 07:41:11,1,1,1,1,4.51,4.51,8.988,1,,,,,,,,,,,,"Small, maybe a couple inches tall.","Either round or square with flat, solid edges.",5.192,5.192,33.837,1,"It was interesting, thanks!",9,26,2,2,English,1,HighCurl,ShapeSecond,,39.917098999023,-76.725601196289,-1,
R_3n8UaxoPRfwdsHT,Default Response Set,Anonymous,,,73.2.32.170,0,2017-04-03 07:51:29,2017-04-03 07:54:00,1,1,1,1,0,0,10.278,0,,,,,,,,,,,,Small,Square,3.834,3.834,26.636,1,I generally use that gesture to describe small things,9,34,1,2,English,1,HighCurl,ShapeSecond,,36.80110168457,-119.80250549316,-1,
R_2VdOLELxiISNM7G,Default Response Set,Anonymous,,,47.223.174.62,0,2017-04-03 07:54:33,2017-04-03 07:57:00,1,1,1,,,,,,1,0,0,9.283,0,Like the letter C,average sized hand,16.048,16.048,33.105,1,,,,,,,I thought it was very odd.,9,40,1,1,english,1,LowCurl,ShapeFirst,,32.122299194336,-95.922698974609,-1,
R_1Ein8R2ZziVvEwS,Default Response Set,Anonymous,,,162.201.216.94,0,2017-04-03 07:58:17,2017-04-03 08:00:13,1,1,1,,,,,,1,0,0,7.292,0,,,,,,,Large on the screen but small in real life.,Some sort of animal. ,2.868,24.481,42.127,2,No comment.,9,39,1,1,English,1,LowCurl,ShapeSecond,,41.998992919922,-87.821998596191,-1,
R_2bWAfwJUlXCjL6Z,Default Response Set,Anonymous,,,71.49.105.58,0,2017-04-03 07:58:59,2017-04-03 08:00:35,1,1,1,1,0,0,9.195,0,,,,,,The letter c backwards,Medium size not to big not to small just right,2.247,11.762,26.756,2,,,,,,,none,9,30,2,1,english,1,HighCurl,ShapeFirst,,26.629196166992,-81.943199157715,-1,
R_1q21xgmIG8v3pS3,Default Response Set,Anonymous,,,50.139.148.122,0,2017-04-03 07:57:45,2017-04-03 08:00:36,1,1,1,1,0,0,9.365,0,,,,,,,,,,,,3 inches,round,4.125,27.652,29.642,4,"I don't have any further comments, questions, thoughts or ideas you have on the gesture you just saw or the question you asked about it.",9,42,1,1,English,1,HighCurl,ShapeSecond,,42.121002197266,-72.489601135254,-1,
R_1F9EOvFx7xWeA4c,Default Response Set,Anonymous,,,96.86.36.141,0,2017-04-03 08:02:53,2017-04-03 08:03:55,1,1,1,,,,,,1,0,0,7.003,0,a circle as the index and thumb were formulated into a circle shape ,a small size due to the small size of the hand ,1.622,15.578,26.106,2,,,,,,,it looked like an OK symbol ,9,23,2,2,english,1,LowCurl,ShapeFirst,,38.934799194336,-77.267196655273,-1,
R_1GQiqceXy6mLQ19,Default Response Set,Anonymous,,,98.91.0.68,0,2017-04-03 08:02:43,2017-04-03 08:04:32,1,1,1,1,0,0,8.603,0,,,,,,,,,,,,The object's size was small or tiny.,The object's shape was round.,5.336,5.336,40.62,1,no comments,9,40,1,1,english,1,HighCurl,ShapeSecond,,32.964706420898,-80.201499938965,-1,
R_a05iKPyWZMIfgLD,Default Response Set,Anonymous,,,136.61.83.179,0,2017-04-03 08:03:37,2017-04-03 08:06:42,1,1,1,,,,,,1,0,0,10.381,0,The object is round.,"The object is small, maybe twice the size of a quarter.",11.219,23.308,53.297,2,,,,,,,"You should give more detailed instructions than just saying it ""characterizes an object"". With just that I don't know what kind of answer you are looking for.",9,29,1,1,English,1,LowCurl,ShapeFirst,,39.106796264648,-94.56600189209,-1,
R_0Sxoz1JMpsrNWuZ,Default Response Set,Anonymous,,,50.131.187.121,0,2017-04-03 08:06:02,2017-04-03 08:07:55,1,1,1,,,,,,1,0,0,7.925,0,"Probably round, maybe with something protruding from it",About the size of a coffee cup,2.666,2.666,29.759,1,,,,,,,No comments,9,36,1,1,English,1,LowCurl,ShapeFirst,,37.811599731445,-122.24200439453,-1,
R_UVGvXXFeypFGspP,Default Response Set,Anonymous,,,104.15.198.42,0,2017-04-03 08:03:53,2017-04-03 08:09:05,1,1,1,,,,,,1,0,0,15.493,0,,,,,,,It was a small object about the size of your hand.,The shape of the object was like a backwards C with a small square on the top right-hand side.,9.604,41.862,77.032,3,I could not come up with a guess as to what the gesture meant.,9,44,2,1,English,1,LowCurl,ShapeSecond,,39.687805175781,-82.604598999023,-1,
R_2zAeMQrMtuE1NCB,Default Response Set,Anonymous,,,69.242.81.228,0,2017-04-03 08:09:55,2017-04-03 08:11:31,1,1,1,1,0,0,8.579,0,,,,,,round,small,1.771,7.147,11.25,2,,,,,,,none,9,47,2,2,english,1,HighCurl,ShapeFirst,,39.968307495117,-75.826698303223,-1,
R_R8Zx0SCLUKbNPzz,Default Response Set,Anonymous,,,192.136.223.46,0,2017-04-03 08:09:53,2017-04-03 08:12:30,1,1,1,,,,,,1,0,0,9.723,0,,,,,,,About two 5 inches in diameter with a 2 inch opening on the end.,Looked like a circular shape with something that is attached but showing directly behind it.  Something like a piggie bank with money stuck at the top.,2.118,2.118,60.329,1,Really hard to come up with much for it tbh based on that hand gesture.,9,31,1,1,English,1,LowCurl,ShapeSecond,,32.661499023438,-97.169403076172,-1,
R_8GLWQhwR9o8F35n,Default Response Set,Anonymous,,,173.175.168.39,0,2017-04-03 08:56:27,2017-04-03 08:58:21,1,1,1,1,0,0,10.262,0,,,,,,A circle made by a hand,Small and about 4 inches,7.915,7.915,17.332,1,,,,,,,fun!,9,29,1,1,English,1,HighCurl,ShapeFirst,,31.783203125,-106.49759674072,-1,
R_RwMGLUELAzfdQ7D,Default Response Set,Anonymous,,,142.196.229.160,0,2017-04-03 08:56:31,2017-04-03 09:00:06,1,1,1,,,,,,1,7.423,8.225,10.603,6,,,,,,,large,letter c shape,4.826,10.145,16.746,2,This looked like someone was showing a letter C,9,43,1,1,English,1,LowCurl,ShapeSecond,,28.676605224609,-81.199096679688,-1,
R_10ZMCDGAI0GqklG,Default Response Set,Anonymous,,,98.230.94.96,0,2017-04-03 09:00:09,2017-04-03 09:03:34,1,1,1,1,0,0,9.181,0,,,,,,A backwards C and kind of circular but not a full circle.,About 5 inches.,3.411,42.97,45.234,4,,,,,,,None,9,35,2,1,English,1,HighCurl,ShapeFirst,,30.231597900391,-85.501998901367,-1,
R_2CkdGLbwedpapgS,Default Response Set,Anonymous,,,50.39.189.221,0,2017-04-03 09:05:43,2017-04-03 09:08:10,1,1,1,,,,,,1,0,0,12.076,0,"It's like a letter ""C""",size is about four inches in diameter.,2.159,15.927,29.556,2,,,,,,,The hand looks like a cartoon picture.,9,44,1,1,"Indonesian, English.",1,LowCurl,ShapeFirst,,45.445999145508,-122.88200378418,-1,
R_2XbSBoxH4LrZw0S,Default Response Set,Anonymous,,,98.183.146.2,0,2017-04-03 09:43:31,2017-04-03 09:45:29,1,1,1,,,,,,1,0,0,7.151,0,"The object is circular with a knob at the top, potentially ears.",The object is medium to large in size.,1.807,21.727,33.792,3,,,,,,,I believe it was meant to symbolize an animal.,9,26,2,1,English,1,LowCurl,ShapeFirst,,36.796798706055,-76.176696777344,-1,
R_2uTCKHgy5qtD1Gk,Default Response Set,Anonymous,,,24.93.137.110,0,2017-04-03 09:43:52,2017-04-03 09:45:42,1,1,1,,,,,,1,0,0,8.279,0,,,,,,,Size is how large or small an object is.,Shape describes the form that it takes.,3.461,3.461,31.221,1,"Made sense, good survey.",9,24,1,1,English,1,LowCurl,ShapeSecond,,44.173294067383,-69.124801635742,-1,
R_2P0Q0hKfCF2fvg0,Default Response Set,Anonymous,,,108.232.39.22,0,2017-04-03 09:45:09,2017-04-03 09:46:52,1,1,1,1,0,0,7.828,0,,,,,,The letter C,Medium,3.628,3.628,16.896,1,,,,,,,none,9,40,2,2,English,1,HighCurl,ShapeFirst,,35.462295532227,-97.341903686523,-1,
R_1ietHaY7zuhmDJL,Default Response Set,Anonymous,,,68.190.248.238,0,2017-04-03 09:47:31,2017-04-03 09:50:13,1,1,1,,,,,,1,0,0,7.857,0,,,,,,,Large,round,4.803,4.803,11.868,1,none,9,44,2,1,english,1,LowCurl,ShapeSecond,,33.831497192383,-118.18470001221,-1,
R_2pLTG1pdqvelD5c,Default Response Set,Anonymous,,,173.90.75.108,0,2017-04-03 09:49:25,2017-04-03 09:51:01,1,1,1,1,0,0,11.356,0,,,,,,,,,,,,"Small, perhaps less than an inch.",It was square or rectangular. Not round.,1.526,1.526,25.825,1,no issue,9,40,1,1,english,1,HighCurl,ShapeSecond,,40.899597167969,-81.439598083496,-1,
R_3fpnhi10GSd9fJD,Default Response Set,Anonymous,,,98.146.70.177,0,2017-04-03 09:59:18,2017-04-03 10:00:46,1,1,1,,,,,,1,0,0,7.981,0,circle,similar to the size of a golf ball,3.638,3.638,22.895,1,,,,,,,none,9,25,2,1,english,1,LowCurl,ShapeFirst,,47.789199829102,-117.02659606934,-1,
R_3HYSkfuMA5PKv0v,Default Response Set,Anonymous,,,104.52.25.66,0,2017-04-03 10:01:33,2017-04-03 10:03:06,1,1,1,,,,,,1,0,0,8.037,0,The objects shape was a half moon.,The size is very large.,1.453,1.453,24.77,1,,,,,,,The hand gesture was quite interesting to look at.,9,42,2,2,English,1,LowCurl,ShapeFirst,,34.168304443359,-118.37300109863,-1,
R_1GDJrjHNf38AWvh,Default Response Set,Anonymous,,,74.140.7.97,0,2017-04-03 10:01:25,2017-04-03 10:04:15,1,1,1,,,,,,1,0,0,8.739,0,,,,,,,Medium,Circular,5.937,5.937,42.417,1,I was supposed to focus on the gesture and try to figure out what it was symbolizing. I haven't got a clue though. ,9,27,2,1,"Russian, English ",1,LowCurl,ShapeSecond,,40.117599487305,-83.126502990723,-1,
R_2WD8BwB57cfGx1J,Default Response Set,Anonymous,,,75.169.174.64,0,2017-04-03 10:01:50,2017-04-03 10:04:33,1,1,1,1,0,0,7.554,0,,,,,,"A backwards ""C""",About 4 inches high and across,1.619,44.364,48.806,2,,,,,,,I don't have any comments or thoughts about the gesture.,9,29,1,1,English,1,HighCurl,ShapeFirst,,40.657592773438,-111.88400268555,-1,
R_2aqSU3ukxwLsvPW,Default Response Set,Anonymous,,,201.218.40.198,0,2017-04-03 09:59:28,2017-04-03 10:05:08,1,1,1,1,0,0,11.039,0,,,,,,,,,,,,2 inches,square,1.046,1.046,11.989,1,I think its a common gesture. ,9,27,2,1,"English, Spanish",1,HighCurl,ShapeSecond,,-1.0500030517578,-80.449996948242,-1,
R_3KxU4Cow9iqJU1X,Default Response Set,Anonymous,,,107.13.179.25,0,2017-04-03 10:05:09,2017-04-03 10:07:05,1,1,1,1,0,0,9.049,0,,,,,,,,,,,,2-3 inches in diameter,circular,9.447,15.898,31.621,2,none,9,29,2,1,English,1,HighCurl,ShapeSecond,,35.746307373047,-78.723899841309,-1,
R_3DvU26ntjrrsA4n,Default Response Set,Anonymous,,,209.147.144.11,0,2017-04-03 10:08:48,2017-04-03 10:10:03,1,1,1,,,,,,1,3.692,3.692,9.493,1,,,,,,,small,round,1.876,5.795,9.255,2,looked like a coffee cup,9,25,1,1,English,1,LowCurl,ShapeSecond,,33.414794921875,-111.90930175781,-1,
R_1ITAR1KvLAyVTrb,Default Response Set,Anonymous,,,50.137.47.45,0,2017-04-03 10:16:17,2017-04-03 10:17:42,1,1,1,,,,,,1,0,0,9.796,0,,,,,,,2.5 inch diameter,round; circle,1.856,1.856,23.622,1,dont have any,9,29,2,1,english,1,LowCurl,ShapeSecond,,44.639099121094,-123.27099609375,-1,
R_2v99PbSzXQICSrW,Default Response Set,Anonymous,,,8.35.165.165,0,2017-04-03 10:15:55,2017-04-03 10:17:56,1,1,1,,,,,,1,6.893,6.893,8.418,1,,,,,,,The object was the size of a child's hand. ,"The shape was rounded, and was life-like, appearing like a natural human hand.",2.163,2.163,56.859,1,No issues,9,32,1,1,English,1,LowCurl,ShapeSecond,,42.768402099609,-78.887100219727,-1,
R_3I05cr9Mrj0QytX,Default Response Set,Anonymous,,,71.251.200.33,0,2017-04-03 10:17:18,2017-04-03 10:18:21,1,1,1,1,0,0,7.024,0,,,,,,,,,,,,Small - fits between the fingers.,"Probably straight, possibly slightly bent.",1.521,1.521,18.271,1,"It is a common gesture for ""tiny"" object",9,29,1,1,English,1,HighCurl,ShapeSecond,,40.751800537109,-74.066200256348,-1,
R_2YPyQmeo6nGeKvs,Default Response Set,Anonymous,,,97.89.231.42,0,2017-04-03 10:15:59,2017-04-03 10:18:42,1,1,1,1,0,0,9.329,0,,,,,,,,,,,,The objects size is about 5 inches in diameter.,The objects shape is circular. ,4.735,57.959,60.203,2,The perception of the objects size must change based on the size of the viewers hand. ,9,29,1,1,English,1,HighCurl,ShapeSecond,,35.387405395508,-78.868598937988,-1,
R_2CrG2spW71Fm5TU,Default Response Set,Anonymous,,,98.221.117.79,0,2017-04-03 10:16:27,2017-04-03 10:19:54,1,1,1,1,0,0,7.346,0,,,,,,"The object appears to be crescent-shaped, because the person's thumb and index finger are not touching.  ","The object seems to be small, perhaps the size of a lemon.",0.576,40.077,87.585,3,,,,,,,No questions or comments.,9,53,2,1,"English is my only language, although I do know a few phrases in French and Spanish.",1,HighCurl,ShapeFirst,,39.391403198242,-74.518203735352,-1,
R_r9c27ejnxhBoYdb,Default Response Set,Anonymous,,,70.185.215.186,0,2017-04-03 10:15:48,2017-04-03 10:20:02,1,1,1,,,,,,1,0,0,7.649,0,a round or circle shape,about the size of a large coin,2.232,44.543,58.231,4,,,,,,,"The gesture could be just an estimation of the height of something small, not the whole shape. ",9,35,2,1,English,1,LowCurl,ShapeFirst,,36.146697998047,-95.955497741699,-1,
R_emKVpvu6DmBBWhz,Default Response Set,Anonymous,,,68.10.186.94,0,2017-04-03 10:20:46,2017-04-03 10:22:44,1,1,1,,,,,,1,6.075,6.075,11.222,1,CIRCLE,CUPCAKE,12.782,12.782,21.341,1,,,,,,,NONE,9,24,2,1,ENGLISH,1,LowCurl,ShapeFirst,,37.062698364258,-76.405197143555,-1,
R_3smLM2f1ZL1PEiZ,Default Response Set,Anonymous,,,108.254.224.255,0,2017-04-03 10:31:36,2017-04-03 10:33:26,1,1,1,1,0,0,7.457,0,,,,,,,,,,,,It was about the size of a lemon,it was a c shape. ,8.055,10.372,56.963,2,na,9,27,2,1,English,1,HighCurl,ShapeSecond,,34.617004394531,-89.907997131348,-1,
